{"artifacts":[{"artifact_id":"gauntlet-native-results","kind":"benchmark_native_results","sha256":"c867da545421b107fe48a717c05c48afcf5942bfede8c76e88e97011433b2973","uri":"/tmp/claude-0/-home-user-agent-memory/d41e5087-c642-5965-a920-d612859a1976/scratchpad/gauntlet-folded/probe/gauntlet-gauntlet-orchestration-retrieval-probe-v1-agent-memory-runtime-baseline-v7-241bce96bc0b/native-results.json"}],"authority_effect":"none","benchmark":{"dataset_id":"gauntlet-orchestration-retrieval-probe-v1","dataset_revision":"0.1.0","id":"agent-memory-gauntlet-gauntlet-orchestration-retrieval-probe-v1","input_sha256":"fb970e7877370d4897205a7e057d503d305171d04af28345f37bb01c5d629790","source_revision":"0.1.0","task_profile":"gauntlet-orchestration-retrieval-probe-v1"},"dimensions":{"currentness":{"metrics":[],"notes":[],"status":"not_applicable"},"efficiency":{"metrics":[{"direction":"lower_better","metric_id":"run_elapsed_ms","population":"one orchestration probe run","state":"measured","unit":"ms","value":426.06755799897655},{"direction":"lower_better","metric_id":"operation_elapsed_ms_p50","population":"adapter-reported operation timings","state":"measured","unit":"ms","value":19.717936500455835}],"notes":[],"status":"measured"},"evaluator_integrity":{"metrics":[{"denominator":8,"direction":"higher_better","metric_id":"operation_contract_valid_rate","note":"every response crossed the operation-envelope validator","population":"operation responses","state":"measured","unit":"fraction","value":1.0}],"notes":[],"status":"measured"},"governance":{"metrics":[],"notes":["This orchestration probe does not exercise governance claims."],"status":"not_measured"},"reasoning":{"metrics":[],"notes":[],"status":"not_applicable"},"reproducibility":{"metrics":[{"direction":"descriptive","metric_id":"fixture_sha256","population":"probe fixture","state":"measured","value":"fb970e7877370d4897205a7e057d503d305171d04af28345f37bb01c5d629790"},{"direction":"descriptive","metric_id":"adapter_manifest_sha256","population":"validated adapter manifest","state":"measured","value":"135706f2c3b3d626b9b5e577cf889d518a74283db1dcefc52918f434711eeb45"}],"notes":[],"status":"measured"},"retrieval":{"metrics":[{"denominator":3,"direction":"higher_better","metric_id":"exact_top1","note":"baseline_or_probe metric; not independent efficacy evidence","population":"gauntlet orchestration probe queries","state":"measured","unit":"fraction","value":1.0}],"notes":[],"status":"measured"}},"execution":{"elapsed_ms":491.93241899956774,"environment":{"platform":"linux","python":"3.12.3"},"sample_count":3,"seed":"none","selection_id":"all:fb970e7877370d48","selection_method":"full declared profile workload","started_at":"2026-10-21T17:42:36.463127Z"},"limitations":["This is baseline_or_probe evidence for Gauntlet orchestration, not an independent memory-quality benchmark.","Only three deterministic retrieval queries are exercised."],"native_results":{"authority_effect":"none","correct_top1":3,"elapsed_ms":426.06755799897655,"exact_top1":1.0,"fixture_sha256":"fb970e7877370d4897205a7e057d503d305171d04af28345f37bb01c5d629790","operation_count":8,"operation_elapsed_ms_p50":19.717936500455835,"profile_kind":"baseline_or_probe","rows":[{"exact_top1":true,"expected_id":"probe:cobalt","query":"Which project uses the cobalt ledger?","top_id":"probe:cobalt"},{"exact_top1":true,"expected_id":"probe:amber","query":"What uses the amber queue?","top_id":"probe:amber"},{"exact_top1":true,"expected_id":"probe:cedar","query":"Where is the cedar cache used?","top_id":"probe:cedar"}],"sample_count":3,"transcript":[{"error":null,"operation":"describe","request_id":"gauntlet-gauntlet-orchestration-retrieval-probe-v1-agent-memory-runtime-baseline-v7-241bce96bc0b:0001","result":{"adapter_enforces_memory_policy":false,"frozen_runtime_revision":"2ad4cf23d366fc784a486b0245550230e64bfa25","public_contract":"1.8.0","runtime":"agent-memory-rc1-local","runtime_profile":"rc1-local-sqlite-composition","runtime_version":"0.2.0-rc1","surface":"AgentMemory public facade","system":"Agent Memory","transport":"stdio"},"status":"ok"},{"error":null,"operation":"reset","request_id":"gauntlet-gauntlet-orchestration-retrieval-probe-v1-agent-memory-runtime-baseline-v7-241bce96bc0b:0002","result":{"reset":true,"reset_support":"mapped"},"status":"ok"},{"error":null,"operation":"remember","request_id":"gauntlet-gauntlet-orchestration-retrieval-probe-v1-agent-memory-runtime-baseline-v7-241bce96bc0b:0003","result":{"accepted":true,"fact_uuid":"ref-0004"},"status":"ok"},{"error":null,"operation":"remember","request_id":"gauntlet-gauntlet-orchestration-retrieval-probe-v1-agent-memory-runtime-baseline-v7-241bce96bc0b:0004","result":{"accepted":true,"fact_uuid":"ref-0011"},"status":"ok"},{"error":null,"operation":"remember","request_id":"gauntlet-gauntlet-orchestration-retrieval-probe-v1-agent-memory-runtime-baseline-v7-241bce96bc0b:0005","result":{"accepted":true,"fact_uuid":"ref-0018"},"status":"ok"},{"error":null,"operation":"recall","request_id":"gauntlet-gauntlet-orchestration-retrieval-probe-v1-agent-memory-runtime-baseline-v7-241bce96bc0b:0006","result":{"candidate_count":3,"items":[{"id":"probe:cobalt","text":"Project Alpha uses the cobalt ledger for invoices."},{"id":"probe:amber","text":"Project Beta uses the amber queue for dispatch."},{"id":"probe:cedar","text":"Project Gamma uses the cedar cache for sessions."}]},"status":"ok"},{"error":null,"operation":"recall","request_id":"gauntlet-gauntlet-orchestration-retrieval-probe-v1-agent-memory-runtime-baseline-v7-241bce96bc0b:0007","result":{"candidate_count":3,"items":[{"id":"probe:amber","text":"Project Beta uses the amber queue for dispatch."},{"id":"probe:cobalt","text":"Project Alpha uses the cobalt ledger for invoices."},{"id":"probe:cedar","text":"Project Gamma uses the cedar cache for sessions."}]},"status":"ok"},{"error":null,"operation":"recall","request_id":"gauntlet-gauntlet-orchestration-retrieval-probe-v1-agent-memory-runtime-baseline-v7-241bce96bc0b:0008","result":{"candidate_count":3,"items":[{"id":"probe:cedar","text":"Project Gamma uses the cedar cache for sessions."},{"id":"probe:amber","text":"Project Beta uses the amber queue for dispatch."},{"id":"probe:cobalt","text":"Project Alpha uses the cobalt ledger for invoices."}]},"status":"ok"}]},"run_id":"gauntlet-gauntlet-orchestration-retrieval-probe-v1-agent-memory-runtime-baseline-v7-241bce96bc0b","schema_version":"1.0.0","status":"complete","system":{"adapter_id":"agent-memory-runtime-baseline-v7-stdio","adapter_revision":"git-blob:0f2f18b0d1ec62edc2a1d424af6cbaa967774ec2","configuration_digest":"e4548a487b8c83ef9172bb9076933b493a7d91b9de2239fd5409f7992b88ff82","id":"agent-memory-runtime-baseline-v7","kind":"agent_memory","revision":"git-commit:2ad4cf23d366fc784a486b0245550230e64bfa25"}}
